{
  "id": "challenge-001",
  "number": 1,
  "title": "Cafés de especialidad: ingresos netos por pedido en línea",
  "dataset": "Pedidos en línea de cafés",
  "difficulty": 1,
  "recommended": false,
  "objectives": {
    "lookingFor": "Que practiques a elegir y calcular columnas con SELECT, a filtrar filas con WHERE y a explicar el resultado como KPIs para una decisión comercial.",
    "outcomes": [
      "Obtienes una consulta que calcula el ingreso neto de cada pedido con un alias claro",
      "Obtienes solo los pedidos entregados por la app, filtrados con WHERE",
      "Calculas a mano y explicas ingreso neto, ticket promedio y tasa de cancelación",
      "Redactas una recomendación de negocio de 2–4 líneas con una limitación"
    ],
    "skills": [
      "SELECT y columnas calculadas",
      "Filtrado con WHERE",
      "Alias y orden",
      "Interpretación de KPIs"
    ]
  },
  "scenario": "Eres analista de datos en **Grano Andino**, una tienda en línea de cafés de especialidad con pedidos en Bogotá, Medellín y Cali. La gerente comercial quiere decidir si invierte su próximo presupuesto de marketing en la app móvil. Para eso necesita saber cuánto dinero dejan realmente los pedidos de la app.",
  "task": "Trabajarás con la tabla `pedidos` (un pedido por fila).\n\nDefinimos el **ingreso neto** de un pedido como lo que realmente se cobra tras el descuento:\n\n$$\\text{ingreso\\_neto} = \\text{unidades} \\times \\text{precio\\_unitario} - \\text{descuento}$$\n\nDonde `unidades` es la cantidad comprada, `precio_unitario` es el precio de una unidad en \\$ y `descuento` es el monto total descontado en \\$ en ese pedido.\n\nEn las etapas 1 y 2 escribirás consultas SQL; en la etapa 3 interpretarás por escrito los resultados como indicadores (KPIs) para la gerente.",
  "data": {
    "engine": "duckdb",
    "tables": [
      {
        "name": "pedidos",
        "description": "Un pedido en línea por fila: tienda, canal de compra, categoría, cantidades, precios, descuento, estado y fecha.",
        "columns": [
          {
            "name": "pedido_id",
            "type": "INTEGER",
            "pk": true
          },
          {
            "name": "tienda",
            "type": "VARCHAR",
            "nullable": false
          },
          {
            "name": "canal",
            "type": "VARCHAR",
            "nullable": false
          },
          {
            "name": "categoria",
            "type": "VARCHAR",
            "nullable": false
          },
          {
            "name": "unidades",
            "type": "INTEGER",
            "nullable": false
          },
          {
            "name": "precio_unitario",
            "type": "DECIMAL(10,2)",
            "nullable": false
          },
          {
            "name": "descuento",
            "type": "DECIMAL(10,2)",
            "nullable": false
          },
          {
            "name": "estado",
            "type": "VARCHAR",
            "nullable": false
          },
          {
            "name": "fecha_pedido",
            "type": "DATE",
            "nullable": false
          }
        ],
        "rowCount": 12,
        "sampleRows": [
          [
            1,
            "Bogotá",
            "app",
            "grano",
            2,
            30,
            0,
            "entregado",
            "2026-03-02"
          ],
          [
            2,
            "Bogotá",
            "web",
            "accesorios",
            1,
            45,
            5,
            "entregado",
            "2026-03-03"
          ],
          [
            3,
            "Medellín",
            "app",
            "grano",
            3,
            28,
            4,
            "cancelado",
            "2026-03-03"
          ],
          [
            4,
            "Medellín",
            "web",
            "grano",
            1,
            30,
            0,
            "entregado",
            "2026-03-05"
          ],
          [
            5,
            "Cali",
            "app",
            "capsulas",
            4,
            12.5,
            0,
            "entregado",
            "2026-03-06"
          ],
          [
            6,
            "Cali",
            "telefono",
            "grano",
            2,
            30,
            3,
            "entregado",
            "2026-03-07"
          ],
          [
            7,
            "Bogotá",
            "app",
            "capsulas",
            5,
            12.5,
            2.5,
            "entregado",
            "2026-03-08"
          ],
          [
            8,
            "Bogotá",
            "telefono",
            "accesorios",
            2,
            45,
            0,
            "cancelado",
            "2026-03-09"
          ]
        ]
      }
    ],
    "seedSql": "CREATE TABLE pedidos (pedido_id INTEGER PRIMARY KEY, tienda VARCHAR NOT NULL, canal VARCHAR NOT NULL, categoria VARCHAR NOT NULL, unidades INTEGER NOT NULL, precio_unitario DECIMAL(10,2) NOT NULL, descuento DECIMAL(10,2) NOT NULL, estado VARCHAR NOT NULL, fecha_pedido DATE NOT NULL); INSERT INTO pedidos VALUES (1, 'Bogotá', 'app', 'grano', 2, 30.00, 0.00, 'entregado', DATE '2026-03-02'), (2, 'Bogotá', 'web', 'accesorios', 1, 45.00, 5.00, 'entregado', DATE '2026-03-03'), (3, 'Medellín', 'app', 'grano', 3, 28.00, 4.00, 'cancelado', DATE '2026-03-03'), (4, 'Medellín', 'web', 'grano', 1, 30.00, 0.00, 'entregado', DATE '2026-03-05'), (5, 'Cali', 'app', 'capsulas', 4, 12.50, 0.00, 'entregado', DATE '2026-03-06'), (6, 'Cali', 'telefono', 'grano', 2, 30.00, 3.00, 'entregado', DATE '2026-03-07'), (7, 'Bogotá', 'app', 'capsulas', 5, 12.50, 2.50, 'entregado', DATE '2026-03-08'), (8, 'Bogotá', 'telefono', 'accesorios', 2, 45.00, 0.00, 'cancelado', DATE '2026-03-09'), (9, 'Medellín', 'app', 'accesorios', 1, 45.00, 0.00, 'entregado', DATE '2026-03-10'), (10, 'Cali', 'web', 'capsulas', 3, 12.50, 0.00, 'entregado', DATE '2026-03-11'), (11, 'Bogotá', 'app', 'grano', 4, 28.00, 8.00, 'entregado', DATE '2026-03-12'), (12, 'Medellín', 'telefono', 'capsulas', 2, 12.50, 0.00, 'cancelado', DATE '2026-03-13');"
  },
  "businessQuestions": [
    {
      "id": "challenge-001-bq1",
      "text": "Según los pedidos entregados, ¿qué porcentaje del ingreso neto llega por la app y qué significa eso para decidir si se le destina más presupuesto de marketing?",
      "reflectionGuide": "Idea cotidiana: es como mirar de qué puerta de la tienda entra más dinero. Con los datos, la app aporta \\$319 de \\$483.50 entregados, cerca del 66 %. Eso la hace el canal principal, pero con solo 12 pedidos no es una prueba firme: úsalo como señal para investigar, no como cifra definitiva."
    },
    {
      "id": "challenge-001-bq2",
      "text": "Si la tasa de cancelación de la app es de 1 de 6 pedidos, ¿cómo la compararías con la de los otros canales antes de recomendar una inversión?",
      "reflectionGuide": "Idea cotidiana: un canal que vende mucho pero cancela mucho es como un balde con agujeros. La tasa de cancelación es cancelados dividido entre pedidos totales del canal. En la app es 1/6, cerca de 16,7 %; falta calcular la de web y teléfono para saber si es alta o baja en comparación."
    },
    {
      "id": "challenge-001-bq3",
      "text": "El pedido 11 de la app tiene un ingreso neto de \\$104, muy superior al resto. ¿Cómo cambiaría tu conclusión si ese pedido no existiera?",
      "reflectionGuide": "Idea cotidiana: un cliente muy grande puede inflar un promedio, como una persona muy alta en un grupo pequeño. Sin el pedido 11 la app aportaría \\$215 en vez de \\$319, y la conclusión sobre su peso cambia bastante. Con tablas pequeñas conviene revisar casos extremos antes de decidir."
    }
  ],
  "finalTest": [
    {
      "conceptId": "sql:select",
      "bloom": 1,
      "kind": "opcion_multiple",
      "prompt": "La tabla `pedidos` tiene las columnas `id_pedido`, `canal`, `estado`, `precio_unitario`, `cantidad`, `descuento` y `total_neto`. Tu jefa solo quiere ver el número de cada pedido y su ingreso neto, sin las demás columnas. ¿Qué consulta lo hace?",
      "options": [
        "SELECT id_pedido, total_neto FROM pedidos;",
        "SELECT * FROM pedidos;",
        "SELECT id_pedido FROM pedidos WHERE total_neto;",
        "FROM pedidos SELECT id_pedido, total_neto;"
      ],
      "correctIndex": 0,
      "explanation": "`SELECT` elige las columnas que se muestran (proyección). Se escriben separadas por comas, justo después de `SELECT`, y `FROM` indica la tabla. `SELECT *` trae todas las columnas; `WHERE` sirve para filtrar filas, no para elegir columnas; y el orden `FROM ... SELECT` no es válido en SQL.",
      "id": "challenge-001-t1"
    },
    {
      "conceptId": "sql:select",
      "bloom": 2,
      "kind": "numerica",
      "prompt": "Un pedido en línea tiene `precio_unitario` = \\$14.50, `cantidad` = 3 y `descuento` = \\$4.00 (descuento total del pedido, no por unidad). Defines el ingreso neto como $\\text{precio\\_unitario} \\times \\text{cantidad} - \\text{descuento}$. Escribes `SELECT precio_unitario * cantidad - descuento AS ingreso_neto FROM pedidos;`. ¿Qué valor, en dólares, devuelve la columna `ingreso_neto` para este pedido?",
      "answer": 39.5,
      "tolerance": 0.01,
      "explanation": "Primero se multiplica: $14.50 \\times 3 = 43.50$. Luego se resta el descuento: $43.50 - 4.00 = 39.50$. En el `SELECT` se pueden calcular columnas nuevas con operaciones aritméticas y ponerles nombre con `AS`.",
      "id": "challenge-001-t2"
    },
    {
      "conceptId": "sql:where",
      "bloom": 1,
      "kind": "opcion_multiple",
      "prompt": "Quieres ver solo los pedidos del canal `'web'` cuyo `total_neto` sea mayor a 30. ¿Qué condición escribes después de `WHERE`?",
      "options": [
        "canal = 'web' AND total_neto > 30",
        "canal = 'web' OR total_neto > 30",
        "canal = 'web', total_neto > 30",
        "canal = web AND total_neto > 30"
      ],